<?xml version="1.0"?>
<xs:schema xmlns:xs="http://www.w3.org/2001/XMLSchema"
           elementFormDefault="qualified">
    <xs:element name="guns">
        <xs:complexType>
            <xs:sequence>
                <xs:element name="gun" type="gunType" minOccurs="0" maxOccurs="unbounded"/>
            </xs:sequence>
        </xs:complexType>
    </xs:element>
    <xs:complexType name="gunType">
        <xs:sequence>
            <xs:element name="model" type="xs:string"/>
            <xs:element name="handy" type="handyType"/>
            <xs:element name="origin" type="xs:string"/>
            <xs:element name="material" type="xs:string" maxOccurs="unbounded"/>
            <xs:element name="ttc" type="TTC"/>
        </xs:sequence>
    </xs:complexType>
    <xs:complexType name="TTC">
        <xs:sequence>
            <xs:element name="rangetype" type="rangeType"/>
            <xs:element name="range" type="xs:int"/>
            <xs:element name="sightseeingRange" type="xs:int"/>
            <xs:element name="clipped" type="xs:boolean"/>
            <xs:element name="optical" type="xs:boolean"/>
        </xs:sequence>
    </xs:complexType>

<!--    Availability enum-->
    <xs:simpleType name="availability" final="restriction">
        <xs:restriction>
            <xs:enumeration value="available"/>
            <xs:enumeration value="not available"/>
        </xs:restriction>
    </xs:simpleType>
<!--    RangeType enum-->
    <xs:simpleType name="rangeType" final="restriction">
        <xs:restriction>
            <xs:enumeration value="long"/>
            <xs:enumeration value="mid"/>
            <xs:enumeration value="low"/>
        </xs:restriction>
    </xs:simpleType>

<!--    Handy enum-->
    <xs:simpleType name="handyType" final="restriction">
        <xs:restriction>
            <xs:enumeration value="one_handed"/>
            <xs:enumeration value="two_handed"/>
        </xs:restriction>
    </xs:simpleType>
</xs:schema>